{
  "candidate_sha": "73d414f8b826a7da982df8c8229d4ac41ed8ba33",
  "matrix": {
    "node_count": 42,
    "path": "qualification/manifests/hardware-matrix.json",
    "schema_version": 1,
    "sha256": "1d04716dd79cf3c5ab6a7a2ac251224fe326ad64ef19fa440c06187118b9d7de"
  },
  "records": [
    {
      "acceptance_types": [
        "pcc_threshold",
        "program_cache_stability",
        "clean_teardown"
      ],
      "architecture": "wormhole",
      "branch": "tttv2-standalone-migration",
      "exit_code": 0,
      "finished_utc": "2026-09-03T12:15:08.853836Z",
      "full_sha": "73d414f8b826a7da982df8c8229d4ac41ed8ba33",
      "machine_pool_entry": "wh-lb-42",
      "mesh_device": "N150",
      "metrics_count": 4,
      "node": "wh-n150-rmsnorm-prefill",
      "outcome": "passed",
      "priority": 1,
      "reset": {
        "automatic": false,
        "performed": false,
        "reason": "runner never resets hardware"
      },
      "runner_classification": "passed",
      "source": {
        "evidence_json": {
          "path": "wh-lb-42/20260903T121504.636856Z-wh-n150-rmsnorm-prefill.json",
          "sha256": "4aa98579adb5cf5adf5464621696bfca1da51902c4c305e0789c11a649c5aa6c",
          "size_bytes": 3232
        },
        "pair_sha256": "76e2ca17d17e479cd2268ff86f3fe98de3b3a29d74df7240f71bc5f9162a071f",
        "stdout_log": {
          "path": "wh-lb-42/20260903T121504.636856Z-wh-n150-rmsnorm-prefill.log",
          "sha256": "25095bdcf0ee95d99340bac75d4b69d70274e5625ee017c241894d05e2b0c89c",
          "size_bytes": 1510
        }
      },
      "stage": "module",
      "started_utc": "2026-09-03T12:15:04.636856Z",
      "teardown_status": "process_exited; fixture teardown not independently hardware-verified"
    },
    {
      "acceptance_types": [
        "pcc_threshold",
        "program_cache_stability",
        "clean_teardown"
      ],
      "architecture": "wormhole",
      "branch": "tttv2-standalone-migration",
      "exit_code": 0,
      "finished_utc": "2026-09-03T12:15:42.931617Z",
      "full_sha": "73d414f8b826a7da982df8c8229d4ac41ed8ba33",
      "machine_pool_entry": "wh-lb-42",
      "mesh_device": "N150",
      "metrics_count": 4,
      "node": "wh-n150-rmsnorm-decode",
      "outcome": "passed",
      "priority": 2,
      "reset": {
        "automatic": false,
        "performed": false,
        "reason": "runner never resets hardware"
      },
      "runner_classification": "passed",
      "source": {
        "evidence_json": {
          "path": "wh-lb-42/20260903T121538.564054Z-wh-n150-rmsnorm-decode.json",
          "sha256": "a2b35f3c6fc9641835baf3dc973752ec2b49c9ab9b0918ff73c01f75e1c4438b",
          "size_bytes": 3224
        },
        "pair_sha256": "bf557549a12ae882c4c6a7c6ff4ff895f30c272d95fee72b131ce1aa15f4428a",
        "stdout_log": {
          "path": "wh-lb-42/20260903T121538.564054Z-wh-n150-rmsnorm-decode.log",
          "sha256": "95806e15531b8d7eeb671a4b881aa12f5889f29b07a5dd78b1dc1c1aa5814026",
          "size_bytes": 1509
        }
      },
      "stage": "module",
      "started_utc": "2026-09-03T12:15:38.564054Z",
      "teardown_status": "process_exited; fixture teardown not independently hardware-verified"
    },
    {
      "acceptance_types": [
        "pcc_threshold",
        "program_cache_stability",
        "clean_teardown"
      ],
      "architecture": "wormhole",
      "branch": "tttv2-standalone-migration",
      "exit_code": 0,
      "finished_utc": "2026-09-03T12:15:45.312808Z",
      "full_sha": "73d414f8b826a7da982df8c8229d4ac41ed8ba33",
      "machine_pool_entry": "wh-lb-42",
      "mesh_device": "N150",
      "metrics_count": 4,
      "node": "wh-n150-lm-head",
      "outcome": "passed",
      "priority": 3,
      "reset": {
        "automatic": false,
        "performed": false,
        "reason": "runner never resets hardware"
      },
      "runner_classification": "passed",
      "source": {
        "evidence_json": {
          "path": "wh-lb-42/20260903T121542.980755Z-wh-n150-lm-head.json",
          "sha256": "83083c2783222e0b6fed41bffa3b0d085e5fb69fb0884c09df8aaa34784f0a6c",
          "size_bytes": 3189
        },
        "pair_sha256": "7cc13f0ebb0695e9c62f2e6393a4ab640a03c84699ecc9bcdd421a2b1c955552",
        "stdout_log": {
          "path": "wh-lb-42/20260903T121542.980755Z-wh-n150-lm-head.log",
          "sha256": "357f81bdfff61b5a1232a0b1cefe7d331817531a2ecab13003c9bbaf2f61eccd",
          "size_bytes": 1509
        }
      },
      "stage": "module",
      "started_utc": "2026-09-03T12:15:42.980755Z",
      "teardown_status": "process_exited; fixture teardown not independently hardware-verified"
    },
    {
      "acceptance_types": [
        "pcc_threshold",
        "program_cache_stability",
        "clean_teardown"
      ],
      "architecture": "wormhole",
      "branch": "tttv2-standalone-migration",
      "exit_code": 0,
      "finished_utc": "2026-09-03T12:15:50.378796Z",
      "full_sha": "73d414f8b826a7da982df8c8229d4ac41ed8ba33",
      "machine_pool_entry": "wh-lb-42",
      "mesh_device": "N150",
      "metrics_count": 4,
      "node": "wh-n150-mlp-prefill",
      "outcome": "passed",
      "priority": 4,
      "reset": {
        "automatic": false,
        "performed": false,
        "reason": "runner never resets hardware"
      },
      "runner_classification": "passed",
      "source": {
        "evidence_json": {
          "path": "wh-lb-42/20260903T121545.360534Z-wh-n150-mlp-prefill.json",
          "sha256": "d574dabe69aaeadfb2dcda9690bfedff5bee56be23357c71fde45c38d6c6e74e",
          "size_bytes": 3227
        },
        "pair_sha256": "346a87f215b423a73168633478599a30e75356f153dba2b1ac1bb503debcd8e4",
        "stdout_log": {
          "path": "wh-lb-42/20260903T121545.360534Z-wh-n150-mlp-prefill.log",
          "sha256": "36b80aa84389866e8c28268c4b0b3dc9b662b426418b7fbbf910bde2e28eb140",
          "size_bytes": 1515
        }
      },
      "stage": "module",
      "started_utc": "2026-09-03T12:15:45.360534Z",
      "teardown_status": "process_exited; fixture teardown not independently hardware-verified"
    },
    {
      "acceptance_types": [
        "pcc_threshold",
        "program_cache_stability",
        "clean_teardown"
      ],
      "architecture": "wormhole",
      "branch": "tttv2-standalone-migration",
      "exit_code": 0,
      "finished_utc": "2026-09-03T12:15:55.885306Z",
      "full_sha": "73d414f8b826a7da982df8c8229d4ac41ed8ba33",
      "machine_pool_entry": "wh-lb-42",
      "mesh_device": "N150",
      "metrics_count": 4,
      "node": "wh-n150-mlp-decode",
      "outcome": "passed",
      "priority": 5,
      "reset": {
        "automatic": false,
        "performed": false,
        "reason": "runner never resets hardware"
      },
      "runner_classification": "passed",
      "source": {
        "evidence_json": {
          "path": "wh-lb-42/20260903T121550.427025Z-wh-n150-mlp-decode.json",
          "sha256": "535a16825d56c9f18e29d9a776edc0297f79823faa119de99bbc14df2e4716c0",
          "size_bytes": 3186
        },
        "pair_sha256": "1fa8e97a74f3913dafe3763cb8632c9e708d3e8108ae546955ffa606b65cde75",
        "stdout_log": {
          "path": "wh-lb-42/20260903T121550.427025Z-wh-n150-mlp-decode.log",
          "sha256": "8de6a9e34fa05018d9c0230713cd00b6b1db2e7c67b9ae3339d120ea6f227e09",
          "size_bytes": 1503
        }
      },
      "stage": "module",
      "started_utc": "2026-09-03T12:15:50.427025Z",
      "teardown_status": "process_exited; fixture teardown not independently hardware-verified"
    },
    {
      "acceptance_types": [
        "pcc_threshold",
        "program_cache_stability",
        "clean_teardown"
      ],
      "architecture": "wormhole",
      "branch": "tttv2-standalone-migration",
      "exit_code": 0,
      "finished_utc": "2026-09-03T12:16:01.666599Z",
      "full_sha": "73d414f8b826a7da982df8c8229d4ac41ed8ba33",
      "machine_pool_entry": "wh-lb-42",
      "mesh_device": "N150",
      "metrics_count": 4,
      "node": "wh-n150-attention-prefill",
      "outcome": "passed",
      "priority": 6,
      "reset": {
        "automatic": false,
        "performed": false,
        "reason": "runner never resets hardware"
      },
      "runner_classification": "passed",
      "source": {
        "evidence_json": {
          "path": "wh-lb-42/20260903T121555.934857Z-wh-n150-attention-prefill.json",
          "sha256": "84cdca81d5f802be980981d0feec2684513eec372e4fc67e0dd511186dd78d6f",
          "size_bytes": 3257
        },
        "pair_sha256": "9fb099315e299b23a6a7f63f6040c17e3be2c4e3f97413490c9016052ae93bd1",
        "stdout_log": {
          "path": "wh-lb-42/20260903T121555.934857Z-wh-n150-attention-prefill.log",
          "sha256": "ee4893965675021cc55ff181bc39f6eb672080320f90cef170f29b819d2f3b2f",
          "size_bytes": 1517
        }
      },
      "stage": "module",
      "started_utc": "2026-09-03T12:15:55.934857Z",
      "teardown_status": "process_exited; fixture teardown not independently hardware-verified"
    },
    {
      "acceptance_types": [
        "pcc_threshold",
        "program_cache_stability",
        "clean_teardown"
      ],
      "architecture": "wormhole",
      "branch": "tttv2-standalone-migration",
      "exit_code": 0,
      "finished_utc": "2026-09-03T12:16:06.843184Z",
      "full_sha": "73d414f8b826a7da982df8c8229d4ac41ed8ba33",
      "machine_pool_entry": "wh-lb-42",
      "mesh_device": "N150",
      "metrics_count": 4,
      "node": "wh-n150-attention-decode",
      "outcome": "passed",
      "priority": 7,
      "reset": {
        "automatic": false,
        "performed": false,
        "reason": "runner never resets hardware"
      },
      "runner_classification": "passed",
      "source": {
        "evidence_json": {
          "path": "wh-lb-42/20260903T121601.715679Z-wh-n150-attention-decode.json",
          "sha256": "1391e15ae17610b64d652faa13fa3e78e5055c79d6dbfe57cc99700998511d35",